{
 "schema_version": 2,
 "layer": "Stage 9 — the pre-retrieval intent gate",
 "vintage": "2026-10-18",
 "generated_at": "2026-10-28T05:52:17+00:00",
 "generator": {
  "script": "scripts/eval_intent.py",
  "spec": "analysis/specs/intent_gate.yml",
  "eval_spec": "analysis/specs/intent_gate_eval_v4.yml",
  "git_sha": "613ccf59c2018ff5140c389297c4eb54ac11d115"
 },
 "specs": {
  "gate": {
   "path": "analysis/specs/intent_gate.yml",
   "sha256": "f89b39cc7e0476b436f6c1ffe3b01777c9114421125f213d449708922c95a3b3",
   "frozen_at": "613ccf5"
  },
  "eval": {
   "path": "analysis/specs/intent_gate_eval_v4.yml",
   "sha256": "b7c26dc331567049abca9e12b9f831672d9b9ddc6ab8dac3897f85a575722d21",
   "frozen_at": null
  }
 },
 "corpus": {
  "path": "registry/rag/2026-10-18/corpus.json",
  "sha256": "cba61e7a996e839f2ab04c4e5ea3f66cbbb9967d5ce2aba8a995e41115895b50",
  "chunks": 488,
  "vintage": "2026-10-18"
 },
 "rules": [
  {
   "id": "G01",
   "priority": 10,
   "intent": "answerable",
   "implements": "the scope clause 'why a question cannot be answered' — the corpus answers questions *about* its own limits"
  },
  {
   "id": "G02",
   "priority": 20,
   "intent": "out_of_scope",
   "implements": "the scope clause 'It cannot answer forecast questions'"
  },
  {
   "id": "G03",
   "priority": 30,
   "intent": "out_of_scope",
   "implements": "the scope clause 'the 12 catalogue outcomes …' — a question about a measure the corpus does not carry"
  },
  {
   "id": "G04",
   "priority": 40,
   "intent": "out_of_scope",
   "implements": "the scope clause 'the corpus can answer questions about …' — a request for a recommendation is not a request for an estimate"
  },
  {
   "id": "G08",
   "priority": 45,
   "intent": "out_of_scope",
   "implements": "the scope clause 'the corpus can answer questions about …' — a request for a recommendation is not a request for an estimate"
  },
  {
   "id": "G05",
   "priority": 50,
   "intent": "out_of_scope",
   "implements": "the scope clause 'It cannot answer forecast questions' — a value at a year the corpus does not cover"
  },
  {
   "id": "G09",
   "priority": 55,
   "intent": "out_of_scope",
   "implements": "the scope clause 'questions about countries outside the donor panel'"
  },
  {
   "id": "G06",
   "priority": 60,
   "intent": "refusal_with_reason",
   "implements": "the scope clause 'why a question cannot be answered' — the tenure comparison the data cannot support"
  },
  {
   "id": "G07",
   "priority": 70,
   "intent": "refusal_with_reason",
   "implements": "the scope clause 'anything requiring an estimate the design did not identify'"
  }
 ],
 "held_out": {
  "what_this_is": "the questions the rules were frozen before; the rules are not tuned on it",
  "counts": {
   "answerable": 22,
   "out_of_scope": 19,
   "refusal_with_reason": 8,
   "n_scored_golds": 32,
   "n_needle_checks": 8
  },
  "metrics": {
   "n_questions": 49,
   "intent_accuracy": 0.979592,
   "out_of_scope_refusal": 0.947368,
   "answerable_not_refused": 1.0,
   "refusal_route_resolved": 1.0,
   "refusal_reason_cited": 1.0,
   "route_matches_gold": 0.625
  },
  "gates": {
   "intent_accuracy": {
    "target": 0.9,
    "measured": 0.979592,
    "met": true
   },
   "out_of_scope_refusal": {
    "target": 0.9,
    "measured": 0.947368,
    "met": true
   },
   "answerable_not_refused": {
    "target": 1.0,
    "measured": 1.0,
    "met": true
   },
   "refusal_route_resolved": {
    "target": 1.0,
    "measured": 1.0,
    "met": true
   },
   "refusal_reason_cited": {
    "target": 1.0,
    "measured": 1.0,
    "met": true
   }
  },
  "per_family": [
   {
    "family": "authored",
    "n": 16,
    "intent_accuracy": 1.0,
    "misses": []
   },
   {
    "family": "card",
    "n": 12,
    "intent_accuracy": 1.0,
    "misses": []
   },
   {
    "family": "design_c",
    "n": 4,
    "intent_accuracy": 1.0,
    "misses": []
   },
   {
    "family": "forecast",
    "n": 6,
    "intent_accuracy": 1.0,
    "misses": []
   },
   {
    "family": "past_year",
    "n": 3,
    "intent_accuracy": 1.0,
    "misses": []
   },
   {
    "family": "population",
    "n": 3,
    "intent_accuracy": 1.0,
    "misses": []
   },
   {
    "family": "probe",
    "n": 1,
    "intent_accuracy": 0.0,
    "misses": [
     "P04"
    ]
   },
   {
    "family": "tenure",
    "n": 4,
    "intent_accuracy": 1.0,
    "misses": []
   }
  ],
  "questions": [
   {
    "id": "M1_01",
    "family": "card",
    "question": "What did the published estimate find for Under-5 mortality rate under National VECM / ARDL time series?",
    "expected_intent": "answerable",
    "intent": "answerable",
    "rule_id": null,
    "route": null,
    "route_status": "not_applicable",
    "reason": "no rule matched, and the default is answerable",
    "expected_gap": null,
    "gold": "card:u5mr__B",
    "gold_scored": true,
    "correct": true,
    "route_matches_gold": false
   },
   {
    "id": "M1_02",
    "family": "card",
    "question": "What did the published estimate find for Maternal mortality ratio under Synthetic control (cross-country)?",
    "expected_intent": "answerable",
    "intent": "answerable",
    "rule_id": null,
    "route": null,
    "route_status": "not_applicable",
    "reason": "no rule matched, and the default is answerable",
    "expected_gap": null,
    "gold": "card:mmr__C",
    "gold_scored": true,
    "correct": true,
    "route_matches_gold": false
   },
   {
    "id": "M1_03",
    "family": "card",
    "question": "What did the published estimate find for Penta3 immunisation coverage under State dose-response DiD?",
    "expected_intent": "answerable",
    "intent": "answerable",
    "rule_id": null,
    "route": null,
    "route_status": "not_applicable",
    "reason": "no rule matched, and the default is answerable",
    "expected_gap": null,
    "gold": "card:immun_penta3__A",
    "gold_scored": true,
    "correct": true,
    "route_matches_gold": false
   },
   {
    "id": "M1_04",
    "family": "card",
    "question": "What did the published estimate find for Skilled birth attendance under National VECM / ARDL time series?",
    "expected_intent": "answerable",
    "intent": "answerable",
    "rule_id": null,
    "route": null,
    "route_status": "not_applicable",
    "reason": "no rule matched, and the default is answerable",
    "expected_gap": null,
    "gold": "card:skilled_birth__B",
    "gold_scored": true,
    "correct": true,
    "route_matches_gold": false
   },
   {
    "id": "M1_05",
    "family": "card",
    "question": "What did the published estimate find for Youth literacy (15-24) under Synthetic control (cross-country)?",
    "expected_intent": "answerable",
    "intent": "answerable",
    "rule_id": null,
    "route": null,
    "route_status": "not_applicable",
    "reason": "no rule matched, and the default is answerable",
    "expected_gap": null,
    "gold": "card:literacy_youth__C",
    "gold_scored": true,
    "correct": true,
    "route_matches_gold": false
   },
   {
    "id": "M1_06",
    "family": "card",
    "question": "What did the published estimate find for Primary completion rate under State dose-response DiD?",
    "expected_intent": "answerable",
    "intent": "answerable",
    "rule_id": null,
    "route": null,
    "route_status": "not_applicable",
    "reason": "no rule matched, and the default is answerable",
    "expected_gap": null,
    "gold": "card:primary_completion__A",
    "gold_scored": true,
    "correct": true,
    "route_matches_gold": false
   },
   {
    "id": "M1_07",
    "family": "card",
    "question": "What did the published estimate find for Net enrolment rate, primary under National VECM / ARDL time series?",
    "expected_intent": "answerable",
    "intent": "answerable",
    "rule_id": null,
    "route": null,
    "route_status": "not_applicable",
    "reason": "no rule matched, and the default is answerable",
    "expected_gap": null,
    "gold": "card:ner_primary__B",
    "gold_scored": true,
    "correct": true,
    "route_matches_gold": false
   },
   {
    "id": "M1_08",
    "family": "card",
    "question": "What did the published estimate find for Reported security fatalities under Synthetic control (cross-country)?",
    "expected_intent": "answerable",
    "intent": "answerable",
    "rule_id": null,
    "route": null,
    "route_status": "not_applicable",
    "reason": "no rule matched, and the default is answerable",
    "expected_gap": null,
    "gold": "card:fatalities__C",
    "gold_scored": true,
    "correct": true,
    "route_matches_gold": false
   },
   {
    "id": "M1_09",
    "family": "card",
    "question": "What did the published estimate find for Reported security incidents under State dose-response DiD?",
    "expected_intent": "answerable",
    "intent": "answerable",
    "rule_id": null,
    "route": null,
    "route_status": "not_applicable",
    "reason": "no rule matched, and the default is answerable",
    "expected_gap": null,
    "gold": "card:incidents__A",
    "gold_scored": true,
    "correct": true,
    "route_matches_gold": false
   },
   {
    "id": "M1_10",
    "family": "card",
    "question": "What did the published estimate find for Real GDP growth (y/y) under National VECM / ARDL time series?",
    "expected_intent": "answerable",
    "intent": "answerable",
    "rule_id": null,
    "route": null,
    "route_status": "not_applicable",
    "reason": "no rule matched, and the default is answerable",
    "expected_gap": null,
    "gold": "card:gdp_growth__B",
    "gold_scored": true,
    "correct": true,
    "route_matches_gold": false
   },
   {
    "id": "M1_11",
    "family": "card",
    "question": "What did the published estimate find for Headline inflation (y/y) under Synthetic control (cross-country)?",
    "expected_intent": "answerable",
    "intent": "answerable",
    "rule_id": null,
    "route": null,
    "route_status": "not_applicable",
    "reason": "no rule matched, and the default is answerable",